{
  "$schema": "http://json-schema.org/draft-04/schema#",
  "type": "array",
  "title": "Content Api schema",
  "description": "Payload schema to create or update documents.",
  "items": {
    "type": "object",
    "title": "Document",
    "description": "CMIS Document to create or update",
    "properties": {
      "id": {
        "type": "string",
        "title": "Document ID",
        "description": "ID of the existing document to update."
      },
      "path": {
        "type": "string",
        "title": "Document path",
        "description": "Path of the document to create or update. Folders in the path will be created automaticaly if needed."
      },
      "repositoryId": {
        "type": "string",
        "title": "Repository ID",
        "description": "Repository ID to which updating or creating document belongs."
      },
      "type": {
        "type": "string",
        "title": "Type of the document",
        "description": "The cmis type of the document",
        "default": "bb:structuredcontent"
      },
      "content": {
        "type": "string",
        "title": "Content",
        "description": "Content of the document to create or update"
      },
      "mimeType": {
        "type": "string",
        "description": "Content mime type",
        "default": "application/json; charset=utf-8"
      },
      "length": {
        "type": "integer",
        "title": "Length",
        "description": "Content length"
      },
      "properties": {
        "type": "object",
        "title": "Content item properties",
        "description": "Optional content item properties",
        "properties": {
          "cmis:createdBy": {
            "type": "string",
            "default": "admin"
          },
          "cmis:lastModifiedBy": {
            "type": "string",
            "default": "admin"
          }
        },
        "additionalProperties": true
      }
    },
    "required": ["repositoryId"],
    "anyOf": [
      {
        "required": ["id"]
      },
      {
        "required": ["path"]
      }
    ],
    "additionalProperties": false
  }
}